{
  "schema_name": "join_plan",
  "schema_version": "1.0.0",
  "artifact_id": "art_join_plan",
  "project_id": "prj_demo",
  "revision_id": "rev_001",
  "created_at": "2026-07-23T12:10:00Z",
  "producer": {
    "application_version": "0.1.0",
    "stage": "join_planning",
    "adapter": "deterministic-repair",
    "adapter_version": "1"
  },
  "inputs": [
    {
      "artifact_id": "art_edl",
      "sha256": "eeeeeeeeeeeeeeeeeeeeeeeeeeeeeeeeeeeeeeeeeeeeeeeeeeeeeeeeeeeeeeee"
    },
    {
      "artifact_id": "art_proposals",
      "sha256": "ffffffffffffffffffffffffffffffffffffffffffffffffffffffffffffffff"
    }
  ],
  "config_sha256": "0000000000000000000000000000000000000000000000000000000000000000",
  "output_duration_us": 11000000,
  "joins": [
    {
      "join_id": "join_001",
      "proposal_ids": ["prp_filler_001"],
      "source_cut_range": {"start_us": 6500000, "end_us": 6800000},
      "output_join_us": 6500000,
      "preview_range": {"start_us": 4500000, "end_us": 8500000},
      "join_strategy": "hard_cut_with_micro_audio_crossfade",
      "repair_order": [
        "hard_cut_with_micro_audio_crossfade",
        "adjusted_handles",
        "room_tone",
        "hard_cut"
      ],
      "fallback": "hard_cut",
      "handles": {"pre_handle_us": 2000000, "post_handle_us": 2000000},
      "reason": "Routine filler cleanup uses a short audio-safe join.",
      "status": "planned",
      "repair_action": null,
      "repair_attempt": 0,
      "review_required": false
    }
  ],
  "warnings": []
}
